{
  "name": "ai_coordinator_agent",
  "description": "AI Coordinator that routes requests to specialized experts (Japanese, Home Assistant, or General)",
  "config": {
    "default_llm_provider": "ollama",
    "default_model": "qwen2.5:7b",
    "max_iterations": 3
  },
  "steps": [
    {
      "id": "get_user_request",
      "type": "input",
      "description": "Get the user's question or request",
      "config": {
        "prompt": "What can I help you with today?"
      },
      "outputs": ["user_request"]
    },
    {
      "id": "route_to_expert",
      "type": "llm_chat",
      "description": "Analyze request and route to appropriate expert",
      "config": {
        "provider": "ollama",
        "model": "qwen2.5:7b",
        "temperature": 0.1,
        "system_message": "You are an AI Coordinator that routes user requests to the most appropriate expert.\n\nYour job is to analyze the incoming request and determine which expert should handle it:\n\n1. **JAPANESE EXPERT** - Route requests about:\n   - Japanese language (translations, grammar, writing)\n   - Japanese culture, traditions, customs\n   - Japan travel, geography, history\n   - Japanese food, anime, manga\n   - Japanese business practices\n\n2. **HOME_ASSISTANT EXPERT** - Route requests about:\n   - Home automation and smart home devices\n   - IoT (Internet of Things) setup and troubleshooting\n   - Smart lighting, thermostats, security systems\n   - Home Assistant platform specifically\n   - Smart speakers, voice assistants for home control\n   - Home networking for automation\n\n3. **GENERAL EXPERT** - Route everything else:\n   - Programming and software development\n   - General knowledge questions\n   - Science, math, technology (non-IoT)\n   - Creative writing and content creation\n   - Business and professional advice\n   - Any topic not covered by the specialists\n\nRespond with exactly this JSON format:\n{\n    \"expert\": \"japanese|home_assistant|general\",\n    \"confidence\": 0.0-1.0,\n    \"reasoning\": \"Brief explanation of why this expert was chosen\"\n}"
      },
      "inputs": {
        "message": "Route this request: {request}",
        "request": {
          "from_step": "get_user_request",
          "field": "user_request"
        }
      },
      "outputs": ["routing_decision"]
    },
    {
      "id": "parse_routing_decision",
      "type": "condition",
      "description": "Extract expert choice from routing decision",
      "config": {
        "condition_type": "llm_decision",
        "condition_prompt": "Extract the 'expert' field from this JSON response and return only: japanese, home_assistant, or general",
        "route_options": ["japanese", "home_assistant", "general"]
      },
      "inputs": {
        "routing_decision": {
          "from_step": "route_to_expert",
          "field": "routing_decision"
        }
      },
      "routes": {
        "japanese": "japanese_expert_response",
        "home_assistant": "home_assistant_expert_response",
        "general": "general_expert_response"
      }
    },
    {
      "id": "japanese_expert_response",
      "type": "llm_chat",
      "description": "Get streaming response from Japanese expert",
      "config": {
        "provider": "ollama",
        "model": "qwen2.5:7b",
        "temperature": 0.3,
        "system_message": "You are a specialized Japanese Expert with deep knowledge of Japanese language, culture, and society.\n\nYour expertise includes:\n- Japanese language: grammar, vocabulary, kanji, hiragana, katakana\n- Translation between Japanese and other languages\n- Japanese culture, traditions, and customs\n- Japan's history, geography, and current events\n- Japanese cuisine, cooking techniques, and ingredients\n- Anime, manga, and Japanese entertainment\n- Japanese business etiquette and practices\n- Travel advice for Japan\n\nAlways provide accurate, culturally sensitive information. When translating, provide context and cultural nuances. For language learning, offer clear explanations with examples.\n\nIf a question is not related to Japan or Japanese topics, politely redirect: \"This question would be better handled by our general expert, as it's outside my Japanese specialization.\"\n\nRespond naturally and conversationally while maintaining expertise."
      },
      "inputs": {
        "message": "{request}",
        "request": {
          "from_step": "get_user_request",
          "field": "user_request"
        }
      },
      "outputs": ["expert_response"]
    },
    {
      "id": "home_assistant_expert_response",
      "type": "llm_chat",
      "description": "Get streaming response from Home Assistant expert",
      "config": {
        "provider": "ollama",
        "model": "qwen2.5:7b",
        "temperature": 0.2,
        "system_message": "You are a specialized Home Assistant and Smart Home Expert with deep technical knowledge of home automation.\n\nYour expertise includes:\n- Home Assistant platform: setup, configuration, troubleshooting\n- Smart home devices: lights, switches, sensors, cameras, locks\n- IoT protocols: Zigbee, Z-Wave, WiFi, Matter, Thread\n- Home automation: scenes, automations, scripts\n- Voice assistants: integration with Alexa, Google Home\n- Home networking: VLANs, security for IoT devices\n- Smart thermostats, HVAC control systems\n- Home security and monitoring systems\n- Energy monitoring and management\n\nProvide practical, technical advice with specific configuration examples when helpful. Include safety considerations for electrical work. Suggest compatible devices and troubleshooting steps.\n\nIf a question is not related to home automation or smart home topics, politely redirect: \"This question would be better handled by our general expert, as it's outside my home automation specialization.\"\n\nRespond with clear, actionable guidance while maintaining technical accuracy."
      },
      "inputs": {
        "message": "{request}",
        "request": {
          "from_step": "get_user_request",
          "field": "user_request"
        }
      },
      "outputs": ["expert_response"]
    },
    {
      "id": "general_expert_response",
      "type": "llm_chat",
      "description": "Get streaming response from General expert",
      "config": {
        "provider": "ollama",
        "model": "qwen2.5:7b",
        "temperature": 0.4,
        "system_message": "You are a knowledgeable General Expert capable of handling a wide variety of topics and questions.\n\nYour role is to provide helpful, accurate information on any topic that doesn't fall under specialized domains. This includes:\n- Programming and software development\n- Science, mathematics, and general technology\n- Creative writing and content creation\n- Business and professional advice\n- General knowledge and trivia\n- Problem-solving and analysis\n- Educational content and explanations\n\nProvide clear, well-structured responses. When dealing with technical topics, include examples and explanations suitable for the user's apparent skill level. For complex topics, break down information into digestible parts.\n\nAlways strive to be helpful, accurate, and comprehensive while remaining concise and focused on the user's specific needs."
      },
      "inputs": {
        "message": "{request}",
        "request": {
          "from_step": "get_user_request",
          "field": "user_request"
        }
      },
      "outputs": ["expert_response"]
    }
  ]
}